[
  {
    "id": "PY_OPTIM_000187",
    "language": "python",
    "category": "optimization",
    "instruction": "Optimize string formatting.",
    "input": {
      "title": "Using % formatting",
      "code": "name = \"Alice\"\nage = 30\nmessage = \"Hello %s, you are %d years old\" % (name, age)\n",
      "error_message": ""
    },
    "output": {
      "technical": "f-strings (literal string interpolation) introduced in Python 3.6 evaluate expressions at runtime in C and are faster and more readable than `%` formatting or `.format()`.",
      "beginner": "Using f-strings is the modern, fastest way to plug variables into text.",
      "analogy": "It's like using a modern digital printer instead of a manual typewriter.",
      "solution": "Use f-strings: `f\"Hello {name}, you are {age} years old\"`.",
      "prevention": "Adopt f-strings as the default string formatting method in Python.",
      "optimized_code": "name = \"Alice\"\nage = 30\nmessage = f\"Hello {name}, you are {age} years old\"\n",
      "complexity": {
        "before": "O(1) with overhead",
        "after": "O(1) optimized"
      }
    },
    "metadata": {
      "difficulty": "easy",
      "source": "synthetic",
      "language_version": "Python 3.10",
      "tags": [
        "strings",
        "formatting",
        "f-string"
      ]
    }
  },
  {
    "id": "PY_OPTIM_000188",
    "language": "python",
    "category": "optimization",
    "instruction": "Optimize string formatting.",
    "input": {
      "title": "Using % formatting",
      "code": "name = \"Alice\"\nage = 30\nmessage = \"Hello %s, you are %d years old\" % (name, age)\n",
      "error_message": ""
    },
    "output": {
      "technical": "f-strings (literal string interpolation) introduced in Python 3.6 evaluate expressions at runtime in C and are faster and more readable than `%` formatting or `.format()`.",
      "beginner": "Using f-strings is the modern, fastest way to plug variables into text.",
      "analogy": "It's like using a modern digital printer instead of a manual typewriter.",
      "solution": "Use f-strings: `f\"Hello {name}, you are {age} years old\"`.",
      "prevention": "Adopt f-strings as the default string formatting method in Python.",
      "optimized_code": "name = \"Alice\"\nage = 30\nmessage = f\"Hello {name}, you are {age} years old\"\n",
      "complexity": {
        "before": "O(1) with overhead",
        "after": "O(1) optimized"
      }
    },
    "metadata": {
      "difficulty": "easy",
      "source": "synthetic",
      "language_version": "Python 3.10",
      "tags": [
        "strings",
        "formatting",
        "f-string"
      ]
    }
  },
  {
    "id": "PY_OPTIM_000189",
    "language": "python",
    "category": "optimization",
    "instruction": "Optimize string formatting.",
    "input": {
      "title": "Using % formatting",
      "code": "name = \"Alice\"\nage = 30\nmessage = \"Hello %s, you are %d years old\" % (name, age)\n",
      "error_message": ""
    },
    "output": {
      "technical": "f-strings (literal string interpolation) introduced in Python 3.6 evaluate expressions at runtime in C and are faster and more readable than `%` formatting or `.format()`.",
      "beginner": "Using f-strings is the modern, fastest way to plug variables into text.",
      "analogy": "It's like using a modern digital printer instead of a manual typewriter.",
      "solution": "Use f-strings: `f\"Hello {name}, you are {age} years old\"`.",
      "prevention": "Adopt f-strings as the default string formatting method in Python.",
      "optimized_code": "name = \"Alice\"\nage = 30\nmessage = f\"Hello {name}, you are {age} years old\"\n",
      "complexity": {
        "before": "O(1) with overhead",
        "after": "O(1) optimized"
      }
    },
    "metadata": {
      "difficulty": "easy",
      "source": "synthetic",
      "language_version": "Python 3.10",
      "tags": [
        "strings",
        "formatting",
        "f-string"
      ]
    }
  },
  {
    "id": "PY_OPTIM_000190",
    "language": "python",
    "category": "optimization",
    "instruction": "Optimize string formatting.",
    "input": {
      "title": "Using % formatting",
      "code": "name = \"Alice\"\nage = 30\nmessage = \"Hello %s, you are %d years old\" % (name, age)\n",
      "error_message": ""
    },
    "output": {
      "technical": "f-strings (literal string interpolation) introduced in Python 3.6 evaluate expressions at runtime in C and are faster and more readable than `%` formatting or `.format()`.",
      "beginner": "Using f-strings is the modern, fastest way to plug variables into text.",
      "analogy": "It's like using a modern digital printer instead of a manual typewriter.",
      "solution": "Use f-strings: `f\"Hello {name}, you are {age} years old\"`.",
      "prevention": "Adopt f-strings as the default string formatting method in Python.",
      "optimized_code": "name = \"Alice\"\nage = 30\nmessage = f\"Hello {name}, you are {age} years old\"\n",
      "complexity": {
        "before": "O(1) with overhead",
        "after": "O(1) optimized"
      }
    },
    "metadata": {
      "difficulty": "easy",
      "source": "synthetic",
      "language_version": "Python 3.10",
      "tags": [
        "strings",
        "formatting",
        "f-string"
      ]
    }
  },
  {
    "id": "PY_OPTIM_000191",
    "language": "python",
    "category": "optimization",
    "instruction": "Optimize string formatting.",
    "input": {
      "title": "Using % formatting",
      "code": "name = \"Alice\"\nage = 30\nmessage = \"Hello %s, you are %d years old\" % (name, age)\n",
      "error_message": ""
    },
    "output": {
      "technical": "f-strings (literal string interpolation) introduced in Python 3.6 evaluate expressions at runtime in C and are faster and more readable than `%` formatting or `.format()`.",
      "beginner": "Using f-strings is the modern, fastest way to plug variables into text.",
      "analogy": "It's like using a modern digital printer instead of a manual typewriter.",
      "solution": "Use f-strings: `f\"Hello {name}, you are {age} years old\"`.",
      "prevention": "Adopt f-strings as the default string formatting method in Python.",
      "optimized_code": "name = \"Alice\"\nage = 30\nmessage = f\"Hello {name}, you are {age} years old\"\n",
      "complexity": {
        "before": "O(1) with overhead",
        "after": "O(1) optimized"
      }
    },
    "metadata": {
      "difficulty": "easy",
      "source": "synthetic",
      "language_version": "Python 3.10",
      "tags": [
        "strings",
        "formatting",
        "f-string"
      ]
    }
  },
  {
    "id": "PY_OPTIM_000192",
    "language": "python",
    "category": "optimization",
    "instruction": "Optimize string formatting.",
    "input": {
      "title": "Using % formatting",
      "code": "name = \"Alice\"\nage = 30\nmessage = \"Hello %s, you are %d years old\" % (name, age)\n",
      "error_message": ""
    },
    "output": {
      "technical": "f-strings (literal string interpolation) introduced in Python 3.6 evaluate expressions at runtime in C and are faster and more readable than `%` formatting or `.format()`.",
      "beginner": "Using f-strings is the modern, fastest way to plug variables into text.",
      "analogy": "It's like using a modern digital printer instead of a manual typewriter.",
      "solution": "Use f-strings: `f\"Hello {name}, you are {age} years old\"`.",
      "prevention": "Adopt f-strings as the default string formatting method in Python.",
      "optimized_code": "name = \"Alice\"\nage = 30\nmessage = f\"Hello {name}, you are {age} years old\"\n",
      "complexity": {
        "before": "O(1) with overhead",
        "after": "O(1) optimized"
      }
    },
    "metadata": {
      "difficulty": "easy",
      "source": "synthetic",
      "language_version": "Python 3.10",
      "tags": [
        "strings",
        "formatting",
        "f-string"
      ]
    }
  },
  {
    "id": "PY_OPTIM_000193",
    "language": "python",
    "category": "optimization",
    "instruction": "Optimize string formatting.",
    "input": {
      "title": "Using % formatting",
      "code": "name = \"Alice\"\nage = 30\nmessage = \"Hello %s, you are %d years old\" % (name, age)\n",
      "error_message": ""
    },
    "output": {
      "technical": "f-strings (literal string interpolation) introduced in Python 3.6 evaluate expressions at runtime in C and are faster and more readable than `%` formatting or `.format()`.",
      "beginner": "Using f-strings is the modern, fastest way to plug variables into text.",
      "analogy": "It's like using a modern digital printer instead of a manual typewriter.",
      "solution": "Use f-strings: `f\"Hello {name}, you are {age} years old\"`.",
      "prevention": "Adopt f-strings as the default string formatting method in Python.",
      "optimized_code": "name = \"Alice\"\nage = 30\nmessage = f\"Hello {name}, you are {age} years old\"\n",
      "complexity": {
        "before": "O(1) with overhead",
        "after": "O(1) optimized"
      }
    },
    "metadata": {
      "difficulty": "easy",
      "source": "synthetic",
      "language_version": "Python 3.10",
      "tags": [
        "strings",
        "formatting",
        "f-string"
      ]
    }
  },
  {
    "id": "PY_OPTIM_000194",
    "language": "python",
    "category": "optimization",
    "instruction": "Optimize string formatting.",
    "input": {
      "title": "Using % formatting",
      "code": "name = \"Alice\"\nage = 30\nmessage = \"Hello %s, you are %d years old\" % (name, age)\n",
      "error_message": ""
    },
    "output": {
      "technical": "f-strings (literal string interpolation) introduced in Python 3.6 evaluate expressions at runtime in C and are faster and more readable than `%` formatting or `.format()`.",
      "beginner": "Using f-strings is the modern, fastest way to plug variables into text.",